{"reviewId":"9d8c7b6a-5f4e-4d3c-b2a1-0f9e8d7c6b5a","effect":"archive.delete","paramsDigest":"aaaaaaaaaaaaaaaaaaaaaaaaaaaaaaaaaaaaaaaaaaaaaaaaaaaaaaaaaaaaaaaa","state":"open","createdAt":"2026-10-09T10:00:00.000Z","expiresAt":"2026-10-09T10:10:00.000Z","requiresRecentAuth":true,"consumedOperationId":null,"operationState":null}
