{"reviewId":"9d8c7b6a-5f4e-4d3c-b2a1-0f9e8d7c6b5a","effect":"archive.delete","paramsDigest":"aaaaaaaaaaaaaaaaaaaaaaaaaaaaaaaaaaaaaaaaaaaaaaaaaaaaaaaaaaaaaaaa","state":"consumed","createdAt":"2026-10-09T10:00:00.000Z","expiresAt":"2026-10-09T10:10:00.000Z","requiresRecentAuth":true,"consumedOperationId":"5a6b7c8d-9e0f-4a1b-8c2d-3e4f5a6b7c8d","operationState":"succeeded"}
